{
  "schemaVersion": "0.2.0-oa",
  "evidenceId": "ev:unavailable-001",
  "type": "artifact",
  "source": "missing external payload",
  "sourceKind": "external",
  "location": "refs/external/missing",
  "producedBy": {
    "actorId": "actor:studio",
    "role": "system",
    "displayName": "Studio",
    "authorityLevel": "none"
  },
  "producedAt": "2026-07-26T00:00:00.000Z",
  "freshness": "unknown",
  "status": "unavailable",
  "classification": "confidential",
  "storageMode": "external_payload_ref",
  "availability": "unavailable",
  "bindings": {
    "executionContractId": "xct:oa-001",
    "projectId": "prj:campus360-oa"
  },
  "containsSecrets": false,
  "provenance": {
    "schemaVersion": "0.1.0-oa",
    "provenanceRecordId": "prv:ev-unavailable-001",
    "actor": {
      "actorId": "actor:studio",
      "role": "system",
      "displayName": "Studio",
      "authorityLevel": "none"
    },
    "source": "system",
    "timestamp": "2026-07-26T00:00:00.000Z",
    "correlationId": "corr:oa-t-a6-001"
  }
}
