{
  "schemaVersion": "0.2.0-oa",
  "evidenceId": "ev:stale-001",
  "type": "screenshot",
  "source": "aging UI capture",
  "sourceKind": "system",
  "location": "refs/evidence/ui-capture-old",
  "producedBy": {
    "actorId": "actor:studio",
    "role": "system",
    "displayName": "Studio",
    "authorityLevel": "none"
  },
  "producedAt": "2026-06-01T00:00:00.000Z",
  "freshness": "stale",
  "status": "stale",
  "classification": "internal",
  "storageMode": "internal_payload_ref",
  "availability": "available",
  "bindings": {
    "projectId": "prj:campus360-oa"
  },
  "containsSecrets": false,
  "provenance": {
    "schemaVersion": "0.1.0-oa",
    "provenanceRecordId": "prv:ev-stale-001",
    "actor": {
      "actorId": "actor:studio",
      "role": "system",
      "displayName": "Studio",
      "authorityLevel": "none"
    },
    "source": "system",
    "timestamp": "2026-07-26T00:00:00.000Z",
    "correlationId": "corr:oa-t-a6-001"
  }
}
