{
  "schemaVersion": "0.2.0-oa",
  "evidenceId": "ev:incomplete-001",
  "type": "artifact",
  "source": "partial agent output",
  "sourceKind": "execution_attempt",
  "location": "refs/evidence/partial",
  "producedBy": {
    "actorId": "actor:studio",
    "role": "system",
    "displayName": "Studio",
    "authorityLevel": "none"
  },
  "producedAt": "2026-07-26T00:00:00.000Z",
  "freshness": "fresh",
  "status": "incomplete",
  "classification": "internal",
  "storageMode": "metadata_only",
  "availability": "unknown",
  "bindings": {
    "executionAttemptId": "xat:oa-ok-001",
    "executionContractId": "xct:oa-001"
  },
  "containsSecrets": false,
  "provenance": {
    "schemaVersion": "0.1.0-oa",
    "provenanceRecordId": "prv:ev-incomplete-001",
    "actor": {
      "actorId": "actor:studio",
      "role": "system",
      "displayName": "Studio",
      "authorityLevel": "none"
    },
    "source": "execution_adapter",
    "timestamp": "2026-07-26T00:00:00.000Z",
    "correlationId": "corr:oa-t-a6-001"
  }
}
